{
  "description": "Tea Matrix",
  "icon": "map",
  "kill_chain_order": {
    "tea": [
      "black",
      "blend",
      "green",
      "white",
      "yellow",
      "oolong",
      "post-fermented"
    ]
  },
  "name": "Tea Matrix",
  "namespace": "tea-matrix",
  "type": "tea-matrix",
  "uuid": "c5f2dfb4-21a1-42d8-a452-1d3c36a204ff",
  "version": 1
}
