{
  "description": "ATT&CK Tactic",
  "icon": "map",
  "kill_chain_order": {
    "mitre-attack": [
      "initial-access",
      "execution",
      "persistence",
      "privilege-escalation",
      "defense-evasion",
      "credential-access",
      "discovery",
      "lateral-movement",
      "collection",
      "command-and-control",
      "exfiltration",
      "impact"
    ],
    "mitre-mobile-attack": [
      "initial-access",
      "persistence",
      "privilege-escalation",
      "defense-evasion",
      "credential-access",
      "discovery",
      "lateral-movement",
      "effects",
      "collection",
      "exfiltration",
      "command-and-control",
      "network-effects",
      "remote-service-effects"
    ],
    "mitre-pre-attack": [
      "priority-definition-planning",
      "priority-definition-direction",
      "target-selection",
      "technical-information-gathering",
      "people-information-gathering",
      "organizational-information-gathering",
      "technical-weakness-identification",
      "people-weakness-identification",
      "organizational-weakness-identification",
      "adversary-opsec",
      "establish-&-maintain-infrastructure",
      "persona-development",
      "build-capabilities",
      "test-capabilities",
      "stage-capabilities"
    ]
  },
  "name": "Attack Pattern",
  "namespace": "mitre-attack",
  "type": "mitre-attack-pattern",
  "uuid": "c4e851fa-775f-11e7-8163-b774922098cd",
  "version": 8
}
