{
  "description": "Threat actors are characteristics of malicious actors (or adversaries) representing a cyber attack threat including presumed intent and historically observed behaviour.",
  "icon": "user-secret",
  "name": "Threat Actor",
  "namespace": "misp",
  "type": "threat-actor",
  "uuid": "698774c7-8022-42c4-917f-8d6e4f06ada3",
  "version": 3
}
