{
  "description": "remote administration tool or remote access tool (RAT), also called sometimes remote access trojan, is a piece of software or programming that allows a remote \"operator\" to control a system as if they have physical access to that system.",
  "icon": "eye",
  "name": "RAT",
  "namespace": "misp",
  "type": "rat",
  "uuid": "06825db6-4797-11e7-ac4d-af25fdcdd299",
  "version": 3
}
