{
  "description": "Preventive measures based on the ransomware document overview as published in https://docs.google.com/spreadsheets/d/1TWS238xacAto-fLKh1n5uTsdijWdCEsGIM0Y0Hvmc5g/pubhtml# . The preventive measures are quite generic and can fit any standard Windows infrastructure and their security measures.",
  "icon": "shield",
  "name": "Preventive Measure",
  "namespace": "misp",
  "type": "preventive-measure",
  "uuid": "8168995b-adcd-4684-9e37-206c5771505a",
  "version": 3
}
