{
  "description": "Exploit-Kit is an enumeration of some exploitation kits used by adversaries. The list includes document, browser and router exploit kits.It's not meant to be totally exhaustive but aim at covering the most seen in the past 5 years",
  "icon": "internet-explorer",
  "name": "Exploit-Kit",
  "namespace": "misp",
  "type": "exploit-kit",
  "uuid": "6ab240ec-bd79-11e6-a4a6-cec0c932ce01",
  "version": 4
}
